{
  "schema_version": 1,
  "model_name": "nomic-ai/nomic-embed-text-v1",
  "artifact_format": "onnx",
  "onnx_model_path": "model/model.onnx",
  "tokenizer_path": "tokenizer/tokenizer.json",
  "pooling": "mean",
  "embedding_dimension": 768,
  "max_context_length": 512,
  "model_sha256": "replace-with-64-lowercase-hex-digest",
  "tokenizer_sha256": "replace-with-64-lowercase-hex-digest",
  "source_commit": "60b2c0c3616bba8bd56c1c8ce02d320c79b0b06f",
  "license": "record-approved-model-license-here"
}
